{
  "schema_version": 1,
  "slug": "l-drill",
  "name": "L Drill",
  "category": "Agility",
  "icon": "route",
  "description": "Measure change-of-direction speed through an L-shaped cone course.",
  "instructions": "Set three cones in an L. Athlete follows the prescribed course around the cones and finishes through the line.",
  "measurement": {
    "type": "time",
    "unit": "ms",
    "direction": "lower"
  },
  "attempts": {
    "count": 2,
    "result": "best"
  },
  "timer": {
    "enabled": true,
    "splits": []
  },
  "equipment": ["3 cones"],
  "tags": ["agility", "change-of-direction"],
  "positions": ["ALL"]
}
