{
  "schema_version": 1,
  "slug": "throw-distance",
  "name": "Throw Distance",
  "category": "Power",
  "icon": "throw",
  "description": "Measure the athlete's maximum valid throw distance.",
  "instructions": "Measure from the throwing line to the first landing point and record the longest valid throw in feet.",
  "measurement": {
    "type": "distance",
    "unit": "ft",
    "direction": "higher"
  },
  "attempts": {
    "count": 3,
    "result": "best"
  },
  "timer": {
    "enabled": false,
    "splits": []
  },
  "equipment": ["Throwing implement", "Measuring tape"],
  "tags": ["throw", "power", "distance"],
  "positions": ["ALL"]
}
